{"kind":"SOURCE_LOCATION","lid":"loc:r10:281131b17dabc31189c69716dbc5f506dfd7c0f8:experiments/s5_effect_adapter/receipts/phase_honest.json","path":"experiments/s5_effect_adapter/receipts/phase_honest.json","pinned_identity":"281131b17dabc31189c69716dbc5f506dfd7c0f8","precision":"file","registry":"registry:r10:invariant-r10@ba4e625871b7","snapshot":"snapshot:g0:baseline-ba4e625"}