{"fragment":"/records/13/receipts/1","kind":"SOURCE_LOCATION","lid":"loc:evstate:f1e9b1532f1bb3a96a3bd4cb25203969d0720e26:package-v2.7/evidence_state.json#/records/13/receipts/1","path":"package-v2.7/evidence_state.json","pinned_identity":"f1e9b1532f1bb3a96a3bd4cb25203969d0720e26","precision":"pointer","registry":"registry:evstate:r10-pre-v2.7-2026-09-02-v4-adjudication-applied","snapshot":"snapshot:g0:multi-v1-ba4e625-d217ee2"}