{"fragment":"/claims/183/witnesses/0","kind":"SOURCE_LOCATION","lid":"loc:factory:23141cd132059483c6b1f4aaeb4c241231c43cf9:CLAIM_LEDGER.json#/claims/183/witnesses/0","path":"CLAIM_LEDGER.json","pinned_identity":"23141cd132059483c6b1f4aaeb4c241231c43cf9","precision":"pointer","registry":"registry:factory:invariant-factory@d217ee29a332","snapshot":"snapshot:g0:multi-ba4e625-d217ee2"}