{"fragment":"/invariants/established/13","kind":"SOURCE_LOCATION","lid":"loc:factory:96e463c578ca83af28f8d5609ded82603c369155:mosaic/receipts/INV-R5.json#/invariants/established/13","path":"mosaic/receipts/INV-R5.json","pinned_identity":"96e463c578ca83af28f8d5609ded82603c369155","precision":"pointer","registry":"registry:factory:invariant-factory@d217ee29a332","snapshot":"snapshot:g0:tri-ba4e625-d217ee2-8816e59"}