{"fragment":"/sources/20","kind":"SOURCE_LOCATION","lid":"loc:factory:8da37028b3c5c4d9d26560bbc662b7aec723bee9:mosaic/sources.json#/sources/20","path":"mosaic/sources.json","pinned_identity":"8da37028b3c5c4d9d26560bbc662b7aec723bee9","precision":"pointer","registry":"registry:factory:invariant-factory@d217ee29a332","snapshot":"snapshot:g0:tri-ba4e625-d217ee2-8816e59"}