{"fragment":"/invariants/established/1","kind":"SOURCE_LOCATION","lid":"loc:factory:74ce1a754b6dfd6c1119414d5620caaa7c69b9ab:mosaic/receipts/INV-R5.1.json#/invariants/established/1","path":"mosaic/receipts/INV-R5.1.json","pinned_identity":"74ce1a754b6dfd6c1119414d5620caaa7c69b9ab","precision":"pointer","registry":"registry:factory:invariant-factory@d217ee29a332","snapshot":"snapshot:g0:tri-ba4e625-d217ee2-8816e59"}