{"fragment":"§Identity vs validity","kind":"SOURCE_LOCATION","lid":"loc:computedriven:6a35973aabe626e9c4a21353fcb7475116433f02:docs/failure-model.md#%C2%A7Identity%20vs%20validity","path":"docs/failure-model.md","pinned_identity":"6a35973aabe626e9c4a21353fcb7475116433f02","precision":"heading","registry":"registry:computedriven:computedriven@efa8881a5d44","snapshot":"snapshot:g0:multi-ba4e625-d217ee2"}