{"fragment":"/incidents/14/fixed_by","kind":"SOURCE_LOCATION","lid":"loc:factory:bbc83979a412a5c7279bbb6d44e0bf667372b752:mosaic/defeaters.json#/incidents/14/fixed_by","path":"mosaic/defeaters.json","pinned_identity":"bbc83979a412a5c7279bbb6d44e0bf667372b752","precision":"pointer","registry":"registry:factory:invariant-factory@d217ee29a332","snapshot":"snapshot:g0:multi-v1-ba4e625-d217ee2"}