{"kind":"SOURCE_LOCATION","lid":"loc:r10:07b65e02e6466e284fd4ca6f29f109fd8498fd44:package-v2.7/witnesses/liveness_l1.py","path":"package-v2.7/witnesses/liveness_l1.py","pinned_identity":"07b65e02e6466e284fd4ca6f29f109fd8498fd44","precision":"file","registry":"registry:r10:invariant-r10@ba4e625871b7","snapshot":"snapshot:g0:multi-v1-ba4e625-d217ee2"}