{"fragment":"/defeaters/56/target","kind":"SOURCE_LOCATION","lid":"loc:factory:bbc83979a412a5c7279bbb6d44e0bf667372b752:mosaic/defeaters.json#/defeaters/56/target","path":"mosaic/defeaters.json","pinned_identity":"bbc83979a412a5c7279bbb6d44e0bf667372b752","precision":"pointer","registry":"registry:factory:invariant-factory@d217ee29a332","snapshot":"snapshot:g0:tri-ba4e625-d217ee2-8816e59"}