{"fragment":"/records/15/evidence_class_token_v2_5","kind":"SOURCE_LOCATION","lid":"loc:crosswalk:c7dba29f2035b84386ac66037693f2ef7c4e05f6:package-v2.7/CROSS_REGISTRY_CLAIM_MAP.json#/records/15/evidence_class_token_v2_5","path":"package-v2.7/CROSS_REGISTRY_CLAIM_MAP.json","pinned_identity":"c7dba29f2035b84386ac66037693f2ef7c4e05f6","precision":"pointer","registry":"registry:crosswalk:r10-pre-v2.7-2026-09-02-v4-adjudication-applied","snapshot":"snapshot:g0:baseline-ba4e625"}