{"fragment":"/assumptions/27","kind":"SOURCE_LOCATION","lid":"loc:factory:34a0ca9eadbb1f05e6af7301bab6a46bb9ac948e:mosaic/assumptions.json#/assumptions/27","path":"mosaic/assumptions.json","pinned_identity":"34a0ca9eadbb1f05e6af7301bab6a46bb9ac948e","precision":"pointer","registry":"registry:factory:invariant-factory@d217ee29a332","snapshot":"snapshot:g0:multi-v1-ba4e625-d217ee2"}