{"fragment":"M3","kind":"SOURCE_LOCATION","lid":"loc:r10:cc322249a0ef31c33908f74af4f49ca4e109fac0:package-v2.7/witnesses/adversarial_worlds.py#M3","path":"package-v2.7/witnesses/adversarial_worlds.py","pinned_identity":"cc322249a0ef31c33908f74af4f49ca4e109fac0","precision":"heading","registry":"registry:r10:invariant-r10@ba4e625871b7","snapshot":"snapshot:g0:multi-ba4e625-d217ee2"}