{"fragment":"findings","kind":"SOURCE_LOCATION","lid":"loc:r10:84121b71c027c61ccaea4731003fbcd4c4be87ff:experiments/s5_effect_adapter/RESULT.md#findings","path":"experiments/s5_effect_adapter/RESULT.md","pinned_identity":"84121b71c027c61ccaea4731003fbcd4c4be87ff","precision":"heading","registry":"registry:r10:invariant-r10@ba4e625871b7","snapshot":"snapshot:g0:multi-ba4e625-d217ee2"}