{"fragment":"L226","kind":"SOURCE_LOCATION","lid":"loc:factory:03fc2f6eab56304527e5eb1c1a88af669a9b0d51:scripts/check-federation-invariants.mjs#L226","path":"scripts/check-federation-invariants.mjs","pinned_identity":"03fc2f6eab56304527e5eb1c1a88af669a9b0d51","precision":"line","registry":"registry:factory:invariant-factory@d217ee29a332","snapshot":"snapshot:g0:multi-v1-ba4e625-d217ee2"}